{
  "$schema": "https://json-schema.org/draft/2020-12/schema",
  "$id": "https://post-incident-proofs.local/schemas/pip/v1/LineageBundle.schema.json",
  "title": "LineageBundle",
  "type": "object",
  "additionalProperties": false,
  "required": [
    "schema_version",
    "bundle_id",
    "incident_id",
    "nodes",
    "edges",
    "transformations"
  ],
  "properties": {
    "schema_version": { "const": "pip.LineageBundle.v1" },
    "bundle_id": { "type": "string", "minLength": 1 },
    "incident_id": { "type": "string", "minLength": 1 },
    "nodes": {
      "type": "array",
      "minItems": 1,
      "items": {
        "type": "object",
        "additionalProperties": false,
        "required": ["node_id", "artifact_digest", "role"],
        "properties": {
          "node_id": { "type": "string", "minLength": 1 },
          "artifact_digest": {
            "type": "string",
            "pattern": "^sha256:[a-f0-9]{64}$"
          },
          "role": {
            "type": "string",
            "enum": ["source", "intermediate", "output", "replay"]
          }
        }
      }
    },
    "edges": {
      "type": "array",
      "items": {
        "type": "object",
        "additionalProperties": false,
        "required": ["from_node_id", "to_node_id", "transformation_id"],
        "properties": {
          "from_node_id": { "type": "string", "minLength": 1 },
          "to_node_id": { "type": "string", "minLength": 1 },
          "transformation_id": { "type": "string", "minLength": 1 }
        }
      }
    },
    "transformations": {
      "type": "array",
      "items": {
        "$ref": "TransformationRecord.schema.json"
      }
    }
  }
}
